{"coverageGaps":["Provider did not report token usage or model cost."],"humanActiveSecondsByRole":{"operator":2},"modelCosts":[{"amount":null,"currency":null,"measurement":"unavailable","source":{"kind":"provider","name":"fixture-provider","providerEventId":null,"providerFields":{"billing_endpoint":"unavailable"}}}],"schemaType":"costs","schemaVersion":"evidence/v1","usage":[{"inputTokens":null,"measurement":"unavailable","outputTokens":null,"source":{"kind":"provider","name":"fixture-provider","providerEventId":null,"providerFields":{"usage_endpoint":"unavailable"}},"totalTokens":null}],"wallClockSeconds":10}
